{"completed_at":"2026-08-24T00:02:04Z","reading_id":"urn:uuid:b385225f-578c-4d75-ab38-d228849feab9","schema_version":"reading-product-output/1.0","source":{"book_document_substrate_sha256":"bba7527cd7c22aad0a51319611f0600c6b8695adc4409dfe136c4d86e4c7b183","epub_sha256":"1325ba2f76406fb22a1bb0f02edd735983cc150f64cc4af5bb00fbf6d873f7a7"},"started_at":"2026-08-24T00:00:30Z","status":"complete","units":[{"marginalia":[{"kind":"highlight","marginalia_id":"u000001-m001","source_quote":"durable idea","source_range":{"end":{"chapter_id":1,"char_offset":14,"paragraph_index":3},"start":{"chapter_id":1,"char_offset":2,"paragraph_index":3}}}],"response":"The mark can remain open without closing the reader's question.","sequence_index":1,"settled_at":"2026-08-24T00:01:02Z","source_range":{"end":{"chapter_id":1,"char_offset":37,"paragraph_index":3},"start":{"chapter_id":1,"char_offset":0,"paragraph_index":3}},"understanding":"The first return treats a durable idea as worth revisiting.","unit_id":"u000001"},{"marginalia":[{"body_text":"Returning reveals the reader as part of the annotation.","kind":"note","marginalia_id":"u000002-m001","source_quote":"reader who met them again","source_range":{"end":{"chapter_id":2,"char_offset":46,"paragraph_index":3},"start":{"chapter_id":2,"char_offset":21,"paragraph_index":3}}}],"response":"The same words can support a different path of attention.","sequence_index":2,"settled_at":"2026-08-24T00:02:03Z","source_range":{"end":{"chapter_id":2,"char_offset":47,"paragraph_index":3},"start":{"chapter_id":2,"char_offset":0,"paragraph_index":3}},"understanding":"Returning reveals that the reader also changes between encounters.","unit_id":"u000002"}]}
